{
  "schema": "workflow-bootstrap-profile/v1",
  "id": "chess",
  "version": "1.0.0",
  "display_name": "Chess",
  "description": "Kotlin-Multiplatform-/Webprofil mit Android-, Viewport-, Git-ACL-, Sonar- und Roadmap-Autogrow-Funktionen.",
  "source": {
    "project_root": "D:\\_Scripte\\Chess",
    "git_commit": "fef812316c54be6d9170f7d63712b823671c4586",
    "captured_utc": "2026-08-02T18:35:19.4430861+00:00",
    "entrypoint_sha256": "4a7f93191dd744e57f4b9b6bc915844c939cf8d8c74a481e4f86c4a168922d4e"
  },
  "transformations": [
    "Legacy-Pin-Autoritaet wird nur bei zentral gesetztem CI_BOOTSTRAP_PREVERIFIED=1 deaktiviert.",
    "Cmd-Bootstrap erzeugt im zentral verifizierten Modus keine Legacy-Pins.",
    "Das SonarQube-Startskript wird relativ zum installierten Projekt aufgeloest.",
    "Die zwei PowerShell-7-Ternaerausdruecke der Sonar-Fehlersignatur sind verhaltensgleich fuer den dokumentierten PowerShell-5.1-Fallback formuliert.",
    "Self-Check und Patch-Apply delegieren die Runtime-Integritaet im zentralen Modus an den Bootstrap.",
    "Die doppelt erhaltene UI-Build-Funktion behaelt in beiden Definitionen alle drei historischen Build-Fallbacks."
  ],
  "default_config": "config.default.json",
  "function_catalog": "catalog/functions.json",
  "command_catalog": "catalog/commands.json",
  "payload": [
    {
      "source": "runtime/bin/legacy-ci.ps1",
      "destination": ".ci/bin/legacy-ci.ps1",
      "sha256": "b3d939cc7e42e81b05221818bbf3f560ca38f181c7bf4abe51a4fd3b9482e4d4",
      "size": 19645,
      "role": "profile-entrypoint"
    },
    {
      "source": "runtime/bin/modules/browser-logic.ps1",
      "destination": ".ci/bin/modules/browser-logic.ps1",
      "sha256": "5951f6ed1e881eb4e31c9a1eeaa27ed53748be1b2ffe5c77dee07f312d193fc8",
      "size": 21533,
      "role": "profile-module"
    },
    {
      "source": "runtime/bin/modules/ci-commands-main.ps1",
      "destination": ".ci/bin/modules/ci-commands-main.ps1",
      "sha256": "619c468615b8d2520439d1b5c233cdca3f87d27183efac146cbeeea4a762f9ce",
      "size": 214031,
      "role": "profile-module"
    },
    {
      "source": "runtime/bin/modules/ci-core.ps1",
      "destination": ".ci/bin/modules/ci-core.ps1",
      "sha256": "8b0f161dcd96ef7e617fa457c9bdc27c494378758064b07d439b1b944ad5687b",
      "size": 9923,
      "role": "profile-module"
    },
    {
      "source": "runtime/bin/modules/core-utils.ps1",
      "destination": ".ci/bin/modules/core-utils.ps1",
      "sha256": "f34e304d6152d6509fd8e989788049af37a07a37f5e0889375728e66cccd5114",
      "size": 32523,
      "role": "profile-module"
    },
    {
      "source": "runtime/bin/modules/critic-logic.ps1",
      "destination": ".ci/bin/modules/critic-logic.ps1",
      "sha256": "0c87f1326624841abd9b205e0badc8df18852eff559df96688ef104432d36fb2",
      "size": 9864,
      "role": "profile-module"
    },
    {
      "source": "runtime/bin/modules/observer-logic.ps1",
      "destination": ".ci/bin/modules/observer-logic.ps1",
      "sha256": "e8ab86d42a6416cc016551a4d96e6ef7e0feb11bd00c70788c0792cf48db49d7",
      "size": 20565,
      "role": "profile-module"
    },
    {
      "source": "runtime/bin/modules/project-logic.ps1",
      "destination": ".ci/bin/modules/project-logic.ps1",
      "sha256": "6b062ac0e65864515c9a5b343d487469c02e5ff1f82b6d58b303ed2e9a61fdeb",
      "size": 8767,
      "role": "profile-module"
    },
    {
      "source": "runtime/bin/modules/sonar-logic.ps1",
      "destination": ".ci/bin/modules/sonar-logic.ps1",
      "sha256": "c7194839f305dc2a23a3979ced586c4c1c000a2494c6d5173e200eb4b610d181",
      "size": 6566,
      "role": "profile-module"
    },
    {
      "source": "runtime/bin/modules/todo-engine.ps1",
      "destination": ".ci/bin/modules/todo-engine.ps1",
      "sha256": "76a24a8a878f161f95138e7129c107e4e0c53faf7d59727ad095a0da4a53cde7",
      "size": 28589,
      "role": "profile-module"
    },
    {
      "source": "runtime/bin/modules/toolchain-gradle.ps1",
      "destination": ".ci/bin/modules/toolchain-gradle.ps1",
      "sha256": "189ae3a4122b2c8366d52ecf30a29f094e3a5b4db52fbf4670bde38b9eb0de97",
      "size": 24971,
      "role": "profile-module"
    },
    {
      "source": "runtime/bin/modules/toolchain-java.ps1",
      "destination": ".ci/bin/modules/toolchain-java.ps1",
      "sha256": "ad0893eed8bde6a460f1686fc12a9b2daf4f78bde1a424d7f6736a4b83a7492a",
      "size": 8864,
      "role": "profile-module"
    },
    {
      "source": "runtime/bin/modules/ui-commands.ps1",
      "destination": ".ci/bin/modules/ui-commands.ps1",
      "sha256": "4dfbe01271a4befe7d69b7d7cb2d154543d04f220306e7f9f7ef97ea6c5f0670",
      "size": 11396,
      "role": "profile-module"
    },
    {
      "source": "runtime/bin/modules/verify-logic.ps1",
      "destination": ".ci/bin/modules/verify-logic.ps1",
      "sha256": "851fcc91507e20c251af730fed246c33738984e9e2fee3cab5f9eadebbd2ad07",
      "size": 14970,
      "role": "profile-module"
    },
    {
      "source": "runtime/bin/start_dev_server_internal.ps1",
      "destination": ".ci/bin/start_dev_server_internal.ps1",
      "sha256": "40c4035dabd19cc78a4a8c0b98b16de06190d2fbeed1b2e5a60c045e0ac30777",
      "size": 716,
      "role": "profile-helper"
    },
    {
      "source": "runtime/bin/start_dev.ps1",
      "destination": ".ci/bin/start_dev.ps1",
      "sha256": "5ca50a38ae83a8d5f5f2c8eea839372eb32cb2c4818132f7749da023c2b11c3e",
      "size": 806,
      "role": "profile-helper"
    },
    {
      "source": "runtime/bin/start_devserver.ps1",
      "destination": ".ci/bin/start_devserver.ps1",
      "sha256": "c55d72059e64444191f6bb77a538d4daa280b68284633cd6e459de2df2e50cd5",
      "size": 1559,
      "role": "profile-helper"
    },
    {
      "source": "runtime/bin/start_ktor.ps1",
      "destination": ".ci/bin/start_ktor.ps1",
      "sha256": "cc00925cf4ced624b56c951e47351df6940085356e8b13b56da421bc77d1fa71",
      "size": 813,
      "role": "profile-helper"
    },
    {
      "source": "runtime/bin/start-sonar.ps1",
      "destination": ".ci/bin/start-sonar.ps1",
      "sha256": "070d3f82c80372d2fab5d1b95170e9abadf6880ce5b14cc641a7fc938ab9c953",
      "size": 1569,
      "role": "profile-helper"
    }
  ]
}
